id,name,position
narongpan,พล.อ.ณรงค์พันธ์ จิตต์แก้วแท้,ผู้บัญชาการทหารบก
anuthin,อนุทิน ชาญวีรกูล,รองนายกรัฐมนตรี และรัฐมนตรีว่าการกระทรวงสาธารณสุข
supatphong,สุพัฒนพงษ์ พันธ์มีเชาว์,รองนายกรัฐมนตรี รัฐมนตรีว่าการกระทรวงพลังงาน และ กรรมการศคบ.
taweesin,นพ.ทวีศิลป์ วิษณุโยธิน,โฆษกศูนย์บริหารสถานการณ์การแพร่ระบาดของโรคติดเชื้อไวรัสโคโรนา 2019 (โควิด-19) หรือ ศบค.
prayut,พล.อ.ประยุทธ์ จันทร์โอชา,นายกรัฐมนตรี
pravit,พล.อ.ประวิตร วงษ์สุวรรณ,รองนายกรัฐมนตรี
thaksin,ทักษิณ ชินวัตร,อดีตนายกรัฐมนตรี
bourla,Albert Bourla,CEO ของ Pfizer
thanatorn,ธนาธร จึงรุ่งเรืองกิจ,ประธานคณะก้าวหน้า